Keys,Français,English
M/T/Resume,Compris !,Got it !
M/T/MoveDesc,Déplacer vous sur l'astéroïde,Move on the asteroid
M/T/LookDesc,Regarder aux alentours en déplaçant la caméra,Look around by moving the camera
M/T/JumpDesc,Saute sur l'astéroïde devant toi,Jump on the asteroid in front of you
M/T/SingularityDesc,"La sphère que tu tiens est l'autre joueur, dans sa forme Singularité.
Tu peux le lancer. Essaye !","The sphere you hold is the other player, in the form of Singularity.
You can throw it. Try it !"
M/T/DashDesc,"Tu peux aussi dasher tout droit, pour aller aussi vite que la lumière, même si c'est le comble pour un trou noir !","You can also dash straight ahead, moving as fast as light. Quite ironic for a black hole !"
M/T/ThrowAim,Viser puis tirer (Maintenir),Aim then throw (Hold)
M/T/ThrowAimDesc,"Maintiens enfoncée la touche pour tirer, cela va déclencher la visée.
Quand tu vises, tu déformes l'espace-temps ce qui te permet de ralentir et concentrer ton tir.
Au relâchement, la Singularité sera lancée.","Press and hold the throw button, which triggers the Aiming.
When you aim, you distort space-time, allowing you to slow down and concentrate your shot.
On release, the Singularity will be throwed."